{
  "schema_version": "detona_question_batch_v2",
  "batch_id": "pcba_inv_dadm_08_01_lote_001",
  "contest_id": "pc_ba_2026",
  "position_id": "pc_ba_2026_investigador_policia_civil",
  "discipline_id": "pc_ba_2026_investigador_policia_civil_discipline_nocoes_de_direito_administrativo",
  "topic_id": "pc_ba_2026_investigador_policia_civil_topic_nocoes_de_direito_administrativo_8_regime_juridico_administrativo",
  "canonical_scope": "subtopic",
  "curriculum_node_id": "pc_ba_2026_investigador_policia_civil_subtopic_nocoes_de_direito_administrativo_8_1_conceito",
  "subtopic_id": "pc_ba_2026_investigador_policia_civil_subtopic_nocoes_de_direito_administrativo_8_1_conceito",
  "exam_board": "instituto_aocp",
  "question_type": "multiple_choice",
  "status": "rascunho_revisar",
  "question_count": 20,
  "source_catalog_version": "2.0.0-draft.1",
  "questions": [
    {
      "question_id": "pcba_inv_dadm_08_01_q001",
      "sequence": 1,
      "primary_microknowledge_id": "pc_ba_2026_inv_mk_aec3ec59036f06",
      "secondary_microknowledge_ids": [],
      "pedagogical_role": "diagnostic",
      "competence": "conceituar",
      "reasoning_type": "recognition",
      "statement": "No estudo do Direito Administrativo, a expressão regime jurídico designa uma estrutura normativa aplicável a determinadas relações jurídicas.",
      "command": "Assinale a alternativa correta.",
      "options": [
        {
          "label": "A",
          "text": "Um conjunto de normas que disciplina relações jurídicas."
        },
        {
          "label": "B",
          "text": "Uma relação de atos administrativos sem efeitos externos."
        },
        {
          "label": "C",
          "text": "Um catálogo facultativo de recomendações aos agentes públicos."
        },
        {
          "label": "D",
          "text": "Uma lista exclusiva de sanções aplicáveis aos particulares."
        },
        {
          "label": "E",
          "text": "Um sistema formado apenas por precedentes judiciais vinculantes."
        }
      ],
      "correct_option": "A",
      "difficulty": "facil",
      "explanation": {
        "summary": "O conceito geral de regime jurídico parte de um conjunto de normas aplicáveis a relações jurídicas.",
        "correct_option_analysis": "A alternativa A apresenta o núcleo conceitual sem reduzir o regime a uma única fonte ou função.",
        "option_analysis": {
          "A": "Correta: regime jurídico é o conjunto de normas que disciplina relações jurídicas.",
          "B": "Incorreta: o conceito não se limita a atos administrativos nem exclui efeitos externos.",
          "C": "Incorreta: normas jurídicas não são simples recomendações facultativas.",
          "D": "Incorreta: o regime também organiza direitos, deveres, poderes e restrições.",
          "E": "Incorreta: a jurisprudência pode integrar a interpretação, mas não esgota o conceito."
        },
        "trap": "Confundir regime jurídico com uma lista de atos, sanções ou precedentes.",
        "added_knowledge": "O conteúdo concreto do regime varia conforme a relação e a disciplina normativa aplicável.",
        "learning_takeaway": "Regime jurídico é uma estrutura normativa, não um ato isolado."
      },
      "source_references": [
        {
          "source_id": "pc_ba_2026_inv_dadm_aula_00",
          "location": "páginas 5-6",
          "used_for": "Fundamento doutrinário e revisão técnica."
        }
      ],
      "status": "rascunho_revisar"
    },
    {
      "question_id": "pcba_inv_dadm_08_01_q002",
      "sequence": 2,
      "primary_microknowledge_id": "pc_ba_2026_inv_mk_aec3ec59036f06",
      "secondary_microknowledge_ids": [],
      "pedagogical_role": "teaching",
      "competence": "distinguir",
      "reasoning_type": "conceptual_understanding",
      "statement": "A doutrina diferencia regime de direito público e regime de direito privado pela posição dos sujeitos e pelos interesses protegidos.",
      "command": "Assinale a alternativa correta.",
      "options": [
        {
          "label": "A",
          "text": "O direito público sempre coloca todos os sujeitos em absoluta igualdade formal."
        },
        {
          "label": "B",
          "text": "O direito privado é caracterizado, em regra, pela horizontalidade entre as partes."
        },
        {
          "label": "C",
          "text": "O direito privado concede à Administração poderes unilaterais desconhecidos dos particulares."
        },
        {
          "label": "D",
          "text": "O direito público exclui deveres e restrições para o Estado."
        },
        {
          "label": "E",
          "text": "Os dois regimes são idênticos e a distinção não possui utilidade conceitual."
        }
      ],
      "correct_option": "B",
      "difficulty": "facil",
      "explanation": {
        "summary": "A horizontalidade é característica geral das relações privadas, enquanto o regime público admite verticalidade.",
        "correct_option_analysis": "A alternativa B identifica corretamente a igualdade de posições como regra nas relações privadas.",
        "option_analysis": {
          "A": "Incorreta: o regime público pode produzir relações verticais em razão das prerrogativas estatais.",
          "B": "Correta: nas relações privadas, a regra é a coordenação ou horizontalidade entre as partes.",
          "C": "Incorreta: poderes unilaterais especiais são associados ao regime de direito público.",
          "D": "Incorreta: o regime público combina prerrogativas com sujeições e controles.",
          "E": "Incorreta: embora coexistam na prática, os regimes conservam diferenças conceituais relevantes."
        },
        "trap": "Trocar horizontalidade e verticalidade entre os regimes.",
        "added_knowledge": "A presença da Administração não basta, sozinha, para definir qual regime predomina no caso.",
        "learning_takeaway": "Direito privado tende à horizontalidade; direito público pode conferir posição de supremacia funcional."
      },
      "source_references": [
        {
          "source_id": "pc_ba_2026_inv_dadm_aula_00",
          "location": "páginas 5-6",
          "used_for": "Fundamento doutrinário e revisão técnica."
        }
      ],
      "status": "rascunho_revisar"
    },
    {
      "question_id": "pcba_inv_dadm_08_01_q003",
      "sequence": 3,
      "primary_microknowledge_id": "pc_ba_2026_inv_mk_aec3ec59036f06",
      "secondary_microknowledge_ids": [],
      "pedagogical_role": "reinforcement",
      "competence": "conceituar",
      "reasoning_type": "recognition",
      "statement": "O regime jurídico-administrativo possui sentido mais específico do que o regime jurídico da Administração Pública.",
      "command": "Assinale a alternativa correta.",
      "options": [
        {
          "label": "A",
          "text": "Abrange somente as relações privadas mantidas por empresas estatais."
        },
        {
          "label": "B",
          "text": "Reúne regras eleitorais aplicáveis aos agentes políticos."
        },
        {
          "label": "C",
          "text": "Corresponde aos traços de direito público que conferem prerrogativas e impõem sujeições à Administração."
        },
        {
          "label": "D",
          "text": "Elimina a incidência dos princípios constitucionais administrativos."
        },
        {
          "label": "E",
          "text": "Autoriza o agente público a escolher livremente os fins da atuação estatal."
        }
      ],
      "correct_option": "C",
      "difficulty": "facil",
      "explanation": {
        "summary": "O regime jurídico-administrativo é um regime de direito público marcado por poderes e restrições especiais.",
        "correct_option_analysis": "A alternativa C expressa a bipolaridade entre prerrogativas e sujeições.",
        "option_analysis": {
          "A": "Incorreta: o regime jurídico-administrativo não é sinônimo de regime privado das estatais.",
          "B": "Incorreta: regras eleitorais não definem o conceito examinado.",
          "C": "Correta: prerrogativas e sujeições especiais formam o núcleo do regime jurídico-administrativo.",
          "D": "Incorreta: princípios constitucionais condicionam a atuação administrativa.",
          "E": "Incorreta: a finalidade pública e a legalidade limitam a escolha do agente."
        },
        "trap": "Tratar a expressão como sinônimo de qualquer norma aplicável à Administração.",
        "added_knowledge": "A expressão regime jurídico da Administração é mais ampla e pode abranger direito público e privado.",
        "learning_takeaway": "Regime jurídico-administrativo é o recorte de direito público baseado em prerrogativas e sujeições."
      },
      "source_references": [
        {
          "source_id": "pc_ba_2026_inv_dadm_aula_00",
          "location": "páginas 6-9",
          "used_for": "Fundamento doutrinário e revisão técnica."
        }
      ],
      "status": "rascunho_revisar"
    },
    {
      "question_id": "pcba_inv_dadm_08_01_q004",
      "sequence": 4,
      "primary_microknowledge_id": "pc_ba_2026_inv_mk_aec3ec59036f06",
      "secondary_microknowledge_ids": [],
      "pedagogical_role": "retention",
      "competence": "reconhecer",
      "reasoning_type": "recognition",
      "statement": "As prerrogativas administrativas existem para permitir que o Estado alcance finalidades definidas pelo ordenamento jurídico.",
      "command": "Assinale a alternativa correta.",
      "options": [
        {
          "label": "A",
          "text": "São vantagens pessoais concedidas ao agente público."
        },
        {
          "label": "B",
          "text": "São imunidades absolutas contra o controle judicial."
        },
        {
          "label": "C",
          "text": "São dispensas gerais do dever de motivar os atos."
        },
        {
          "label": "D",
          "text": "São poderes instrumentais orientados à realização do interesse público."
        },